s1,s2,stance
هجوم صاروخي يستهدف مطار في طرابلس ويجبر ليبيا على تغيير مسار الرحلات الجوية,هدوء الاشتباكات فى طرابلس,disagree
ارتفاع على النفط عالميا والسبب الخام الأميركي,الخام الاميركي يسبب انخفاضا في اسعار النفط,disagree
وفاة النجمة سريديفي تثير نقاشا حول الحياة الخفية بمجتمع السينما الهندية,فتح النقاش بشأن الحياة الخفية للسينما الإماراتية بعد وفاة النجمة سريديفي,disagree
ملياردير أميركي مدمن على شراء أسهم أبل,ملياردير أميركي يدمن شراء سيارات تسلا,disagree
أول دولة تواجه موجة الحر بتخفيض أسعار الكهرباء للمواطنين,دولة تواجه موجة حر برفع أسعار الكهرباء,disagree
نيكاي يرتفع لأعلى مستوى منذ 1991,ارتفاع قياسي لمؤشر نيكاي منذ ١٩٩١,agree
الصليب الأحمر يسحب 71 عامل إغاثة من اليمن خوفا على سلامتهم,سحب 71 عامل إغاثة تابعين للصليب الأحمر من اليمن خوفا على سلامتهم,agree
الذهب يرتفع  لأعلى مستوى له منذ 12 أسبوعا,انخفاض الذهب لأدنى مستوى في  ١٢ اسبوعا,disagree
التعاملات المبكرة : تراجع في النفط,صعود في النفط في المعاملات المبكرة,disagree
إجراءات من البنك المركزي التركي لإنقاذ الليرة,المركزي التركي يساهم في مشكلة انخفاض قيمة الليرة,disagree
جماعة فيلق الرحمن توافق على الانسحاب من الغوطة الشرقية,جماعة فيلق الرحمن تنفي إنسحابها من الغوطة الشرقية,disagree
القوات السعودية: اعتراض صاروخ باليستيا من اليمن استهدف نجران,القوات السعودية تفشل فى اعتراض صاروخ استهدف نجران,disagree
الصين تتحدى الولايات المتحدة بـإجراءات جديدة,إجراءات صينية جديدة تتحدى أميركا,agree
ليبيا تصدر حكما بإعدام 45 شخصا متهمين بقتل متظاهرين عام 2011,ليبيا تعلن حكما ببراءة 45 شخصا سبق اتهامهم بقتل المتظاهرين,disagree
أمريكا وتركيا: اتفاق بومبيو وأوغلو على الحوار والتعاون الوثيق لحل الخلافات,خلاف بين بومبيو وأوغلو,disagree
قرابة نصف مليار يورو من فرنسا لصالح لبنان,فرنسا ترفض إقراض لبنان,disagree
مدعية المحكمة الجنايات الدولية تطالب بإنهاء العنف في غزة,محكمة الجنايات الدولية تتجاهل الأوضاع في غزة,disagree
مخزونات الخام الأميركي تهوي بالنفط,مخزونات الخام الأميركي تصعد بالنفط,disagree
جثمان البطش يتعرض للتشريح من قبل السلطات الماليزية,دفن جثمان البطش دون تشريحه,disagree
هل نجحت عقوبات ترامب في هز بازار طهران؟,مساع صينية لردع ترامب بـخطة أوروبية,other
هل النساء اكثر سعادة من الرجال,هل الأطفال اكثر سعادة من الرجال,disagree
بريطانيا تطرح ورقة نقدية جديدة أكثر أمنا,بريطانيا تطرح ورقة نقدية غير آمنة,disagree
قفزة للنفط قبيل توجيه ضربة لسوريا,النفط يهبط لمستوى قياسي قبل توجيه ضربة لسوريا,disagree
ظريف ردا على نتنياهو: افتحوا منشآتكم النووية أمام المفتشين الدوليين,مطالبات من ظريف لنتنياهو بفتح منشآت إسرائيل النووية للمفتشين الدوليين,agree
ارتفاع لسعر الدولار يعوض خسائر التعاملات المبكرة,ارتفاع لسعر اليورو يعوض خسائر التعاملات المبكرة,disagree
الذهب يتراجع مع تصريحات ترامب حول كوريا الشمالية,الذهب يرتفع مع تصريحات ترامب حول كوريا الشمالية,disagree
السيارات الكهربائية في مصر.. ثورة في المحطات والأسعار,السيارات الكهربائية تثير زوبعة في محطات مصر,agree
تركيا تحذر فرنسا من ارتكاب نفس خطأ الولايات المتحدة في سوريا,تركيا تدعو فرنسا للسير على خطى الولايات المتحدة فى سوريا,disagree
الاستخبارات التركية تقتنص مهاجم ريحانلي,اقتنصت المخابرات التركية مهاجم ريحانلى,agree
مصر: تعيين حكومة جديدة والدفاع والداخلية أبرز التغييرات,استمرار الحكومة دون تغيير فى مصر,disagree
القطرية تسعى لتعويض خسائرها بـإجراء جديد,الخطوط الكويتية تتخذ إجراءات لوقف الخسائر,disagree
تيلرسون في أنقرة التي تطالب باستبعاد ميليشيا كردية من قوات سوريا الديمقراطية,حرصت تيلرسون على طرد ميليشيا كردية من القوات السورية,agree
السعودية تأمر بتسليم 25 مدرسة للقطاع الخاص,تسليم ٢٥ مدرسة للقطاع الخاص في المملكة السعودية,agree
رحلة للتاريخ بين لندن وبيرث,رحلة تاريخية بين لندن وبرلين,disagree
الروبل الروسي في أزمة متواصلة وصواريخ ترامب تفاقمها,الروبل الروسي يتعافى وصواريخ ترامب سببا,disagree
الأساطير المحيطة بالممثلين اليهودي في مصر تتحطم على يد المؤرخ السينمائي أشرف غريب,الأساطير المحيطة بالممثلين المجوس في مصر تتحطم على يد المؤرخ السينمائي أشرف غريب,disagree
سوريا: موجة نزوح كبيرة من عفرين مع استمرار الهجمات التركية,نزوح أعداد كبيرة من عفرين مع استمرار الهجمات التركية,agree
بتكوين تهبط لأدنى مستوى وتواصل اتجاها نزوليا,ارتفاع مفاجئ في أسعار البتكوين,disagree
إسرائيل تمنح أكثر من 16 ألف طالب لجوء حق الإقامة الدائمة,منعت إسرائيل أكثر من 16 ألف طالب من الإقامة الدائمة,disagree
الصليب الأحمر يسحب 71 عامل إغاثة من اليمن خوفا على سلامتهم,استمرار اعمال الصليب الأحمر فى اليمن,disagree
احتجاجات على رداءة المياه جنوب غربي إيران,المواطنون يشيدون بحسن جودة المياه جنوب غربي إيران,disagree
المغنية ريانا تنال لقب سفيرة فوق العادة من دولة باربادوس,المغنية لانا ديل راي تنال لقب سفيرة فوق العادة من دولة باربادوس,disagree
تركيا ترد على واشنطن برسوم جمركية,رسوم جمركية جديدة على السلع التركية في أميركا,disagree
مصر.. رسوم جمركية جديدة للتشجيع والاستغناء,رسوم جمركية مصرية على سلع لتشجيع المحلي,agree
دخول مساعدات غذائية للغوطة رغم استمرار القتال والقصف,مساعدات غذائية للغوطة على الرغم من استمرار القتال و العنف,agree
المركزي التركي: لا مؤامرة على الليرة,استهداف الليرة التركية والبنك المركزي يؤكد,disagree
بعد فيسبوك.. غوغل توجه ضربة قوية لعملة بتكوين,غوغل تدعم بت كوين على غرار فيسبوك,disagree
الذهب يرتفع مع تراجع الدولار,الذهب يرتفع مع تراجع النفط,disagree
السودان يفتح أبوابه للاستثمارات الصينية,الصين تستثمر قريباً في الصومال,disagree
إغلاق موقع إلكتروني والقبض على رئيس تحريره في مصر لأسباب إدارية,مصر: إغلاق موقع إلكتروني والقبض على رئيس تحريره بسبب أمور إدارية,agree
اختفاء خاشقجي: ضغوط على السعودية ورجال أعمال يُقاطعون مؤتمرها الاستثماري,جمال خاشقجي: أمس ما يحتاجه العالم العربي هو حرية التعبير,other
الصين تتحدى الولايات المتحدة بـإجراءات جديدة,أميركا تتحدى الصين في إجراءات جديدة,disagree
البشير: حلول جذرية لمشاكل الاقتصاد السوداني,البشير يبشر بحلول اقتصادية جديدة,agree
السعودية تسمح للهند باستخدام مجالها الجوي في رحلاتها إلى تل أبيب,السعودية تغلق مجالها الجوى أمام الهند فى رحلاتها إلى تل أبيب,disagree
خسائر كبيرة لـجنرال إلكتريك,جنرال إلكتريك تخسر الكثير,agree
رغم القرض العملاق.. العملة الأرجنتينية تواصل الانزلاق,فشل دفع عملة الأرجنتين رغم القرض العملاق,agree
11 شاحنة غاز مصرية تدخل قطاع غزة,غاز مصري إلى غزة,agree
زيادة على الرسوم الجمركية في الجزائر,الجزائر تخفض رسومها الجمركية,disagree
تجميد قرار رفع المحروقات بالأردن,العاهل الأردني مع سريان قرار المحروقات الجديد,disagree
تركيا: السجن المؤبد لستة صحفيين لعلاقتهم بالانقلاب,اطلاق سراح 6 صحفيين فى تركيا,disagree
إنفوغرافيك.. الليرة التركية تغوص نحو المجهول,إنفوغرافيك يبين ذهاب الليرة اللبنانية إلى المجهول,disagree
قانون الأوقاف الجديد في سوريا، أين المشكلة؟,قانون الأوقات الجديد فى سوريا يلقى قبول الجميع,disagree
الأمم المتحدة: القتال في الغوطة أدى إلى نزوح 50 ألف مدني,تم تهجير 50 ألف مواطن بسبب القتال في الغوطة,agree
توتال: الاستثمار في النفط الصخري مكلف للغاية,توتال متجهة للاستثمار في النفط الصخري,disagree
تصريحات ترامب تعوض خسائر النفط الأخيرة,إعلان ترامب يلحق خسائر بالغة بأسعار النفط,disagree
اكتشاف حقول معادن ثمينة تسد حاجات العالم لقرون,اكتشاف حقول نفطية تسد الاحتياج العالمي لقرون,disagree
تعرف على من يشملهم قرار مصادرة أملاك رموز حكم صدام حسين,إلغاء مصادرة أملاك رموز حكم صدام حسين,disagree
رئيس الوزراء الإثيوبي يطمئن مصر بشأن سد النهضة,مصر تطمئن أثيوبيا حول سد النهضة,disagree
تقارير عن مقتل وإصابة إسرائيليين على يد مسلح فلسطيني,أنباء عن مقتل أمريكيين على يد مسلح فلسطيني,disagree
اختفاء خاشقجي: تركيا تنتظر التفاهم مع السعودية لبدء تفتيش مقر القنصل باسطنبول,تركيا ترفض التفاهم مع الجانب السعودي,disagree
أمام تراجع أسعار النفط أوبك تتجه لزيادة الإنتاج,أوبك قد تخفض الأنتاج أمام صعود أسعار النفط,disagree
افتتاح أول دار عرض في السعودية منذ أكثر من 35 عاما بفيلم النمر الأسود,السعودية تشيد دارا للأوبرا ضمن استثمارات ترفيهية تكلفتها 64 مليار دولار,other
ترحيب بظهور أشهر عارضات الأزياء الممتلئات في العالم من دون رتوش,هل دفعت قطر أكبر فدية في التأريخ لتحرير الأمراء المخطوفين في العراق؟,other
توقف العمل فى ميناء أم قصر نتيجة للاشتباكات العنيفة فى مظاهرات البصرة,استمرار العمل فى ميناء أم قصر رغم الاشتباكات العنيفة فى مظاهرات البصرة,disagree
بالأرقام.. كيف انهارت الليرة؟ وماذا ينتظر الاقتصاد التركي؟,انهيار الليرة اللبنانية بالأرقام.. و ما هو مصير الاقتصاد الببناني؟,disagree
التضخم يسجل أعلى مستوياته في تركيا منذ أعوام,تسجيل ادنى مستوى للتضخم في تركيا منذ ١٥ عاما,disagree
رئيس الوزراء الإثيوبي يلوح بأن مشروع سد النهضة قد لا يظهر قريبا,رئيس الوزراء الإثيوبي يعلن ظهور مشروع سد النهضة قريبا,disagree
فرض حظر التجول من جديد بعد مقتل متظاهر في احتجاجات البصرة,إلغاء حظر التجول في البصرة,disagree
منظمة حقوقية تعلن ان ليبيا غير جاهزة لإجراء انتخابات حرة ونزيهة,منظمة حقوقية تدعو لإجراء انتخابات في ليبيا,disagree
حادث قطار بشع في البحيرة بمصر نتج عنه مقتل وإصابة العشرات,حادث قطار في القاهرة بمصر نتج عنه إصابة ومقتل العديد,disagree
الرئيس التونسي يدعو إلى المساواة في الميراث بين الرجل والمرأة,عباس يدعو إلى مؤتمر دولي للسلام في الشرق الأوسط منتصف هذا العام,other
أردوغان يرد على ترامب بفرض عقوبات على وزيرين أمريكيين,أردوغان يرفض معاقبة وزيرين أمريكيين بعد تصريحات ترامب,disagree
منظمة حقوقية: ليبيا غير جاهزة لانتخابات حرة ونزيهة,منظمة حقوقية تدعو لإجراء انتخابات في ليبيا,disagree
إسرائيل تشدد إجراءات حظر التدخين في الأماكن العامة,السماح بالتدخين في الأماكن العامة فى إسرائيل,disagree
خطة صينية لغزو سوق السيارات الكهربائية,خطة يابانية لغزو سوق السيارات الكهربائية,disagree
رحيل ميني مي عن عمر لم يتجاوز 49 عاما,وفاة ميني مي عن عمر يناهز 80 عام,disagree
النفط يهبط مع تزايد الإمدادات والتوترات التجارية,الإمدادات والتوترات تؤديان لانخفاض أسعار النفط,agree
مكاسب الجيش تنعش الليرة السورية,الليرة السورية ترتفع مع تقدم الجيش السوري,agree
انتخاب أول امرأة لتولي منصب شيخ مدينة تونس,امرأة فى تونس تفشل فى الحصول على منصب شيخ مدينة,disagree
بت كوين تواصل الهبوط بشكل متسارع,ارتفاع مفاجئ في أسعار البتكوين,disagree
أربعة طائرات تورنادو تقصف مخزن أسلحة كيماوية في سوريا,قصف على مخزن أسلحة كيماوية في سوريا,agree
معركة الحديدة.. المبعوث الأممي يجري مباحثات في صنعاء مع استمرار القتال,المبعوث الأممي يتجاهل الوضع الراهن,disagree
عشيرة الغفران تقدم شكوى ضد قطر فى مجلس حقوق الإنسان,حل أزمة عشيرة الغفران مع قطر,disagree
بريطانيا تخرج من الاتحاد الجمركي الأوروبي,جونسون يدعو ب بريطانيا للبقاء في الاتحاد الجمركي الأوروبي,disagree
فلسطينيون: خرجنا إلى التظاهرات من أجل العودة,هدوء الأوضاع فى فلسطين,disagree
أفضل فيلم جماهيري: جائزة جديدة تضيفها أوسكار,أفضل فيلم سياسي: جائزة جديدة تضيفها أوسكار,disagree
السعودية تعتقل وتمنع من السفر المزيد من ناشطات حقوق الإنسان,السعودية بدون أي اعتقالات,disagree
محاكمة مواطن فرنسي في القدس بتهمة تهريب أسلحة من غزة,فرنسي يفلت من المحاكمة في القدس,disagree
انفجار في مصنع للكيماويات قرب مطار القاهرة بالعاصمة المصرية,انفجار قوى فى مصنوع للمواد الكيماوية بالقرب من مطار القاهرة,agree
التضخم يتراجع في الجزائر,تراجع التضخم النصف سنوي في الجزائر,agree
الليرة التركية.. لماذا لم تنتعش بعد رفع أسعار الفائدة؟,زيادة الفائدة دون تأثير على قيمة الليرة التركية,agree
العملة التركية تتدهور إلى مستوى قياسي جديد,صعود للعملة التركية مجدداً,disagree
الحرب في سوريا: الرئيس الروسي يأمر بوقف إنساني للقتال في الغوطة الشرقية,الرئيس الروسي يعلن استمرار القتال في الغوطة الشرقية فى سوريا,disagree
خطوبة نيك جوناس وبريانكا شوبرا,نيك جوناس وبريانكا شوبرا يؤكدان جوازهما,disagree
تركيا تتعهد بتعقب الزعيم الكردي السوري صالح مسلم أينما ذهب,تركيا تتوقف عن ملاحقة الزعيم الكردي السوري صالح مسلم,disagree
مذكرة تفاهم في خطة ٢٠٣٠ تتمحور حول الطاقة الشمسية,خطة ٢٠٣٠ الاقتصادية تخلو من مشاريع الطاقة الشمسية,disagree
آمال مصرية إيطالية كبيرةبشأن كشف غموض مقتل ريجيني,تطلعات مصرية إيطالية كبيرة تهدف لكشف الغموض عن مقتل ريجينى,agree
فلسطين.. تعديلات ضريبية لزيادة الإيرادات,تعديلات ضريبية فلسطينية لتحسين الإيرادات,agree
ميناء الحديدة الاستراتيجي يشكل معركة حقيقية في اليمن,احتدام المعارك على ميناء الحديدة الاستراتيجي في السعودية,disagree
إحدى متهِمات هارفي واينستين بالتحرش تحرشت جنسيا بصبي,واحدة من متهمات هارفي واينستين تحرشت جنسياً بصبي,agree
السعودية تأمر بتسليم 25 مدرسة للقطاع الخاص,استلام ٢٥ مدرسة للقطاع العام بالسعودية,disagree
تعديلات ضريبية فلسطينية لتحسين الإيرادات,تعديل ضريبي فلسطيني لخفض الإيرادات,disagree
تعرض السعودية لأزمات مستمرة بسبب إختفاء خاشقجي,تعرض تركيا للضغط من قبل رجال الأعمال بسبب إختفاء خاشفجي,disagree
الآلاف يتظاهرون في المغرب ضد سجن قادة الحراك الشعبي,الآلاف في المغرب يدعمون سجن قادة الحراك الشعبي,disagree
الذهب يرتفع مع هبوط الدولار لأدنى مستوياته,انخفاض على أسعار الذهب مع ارتفاع في قيمة الدولار,disagree
صورة قيادي بالإخوان تتصدر صفحة وكالة أنباء الشرق الأوسط المصرية بعد اختراقها,صفحة وكالة أنباء الشرق الأوسط المصرية تُخترق و يظهر عليها صورة أحد قادة الإخوان,agree
النفط يتخطى حاجز الـ80 دولارا,النفط يقل عن ٨٠ دولار,disagree
ارتفاع هو الافضل للذهب خلال ١٢ أسبوعا,انخفاض الذهب لأدنى مستوى في  ١٢ اسبوعا,disagree
تكليف عمر الرزاز برئاسة الحكومة الأردنية,من هو عمر الرزاز المكلف برئاسة الحكومة اللبنانية؟,disagree
انقلاب قارب في نهر النيل بشمال السودان مما نتج عنه مصرع 24 تلميذا,نجاة 24 تلميذا من حادث انقلاب قارب في نهر النيل شمال السودان,disagree
النفط يرتفع قبيل العقوبات الأميركية على إيران,النفط يستقر قبيل العقوبات,disagree
السعودية لا تزال تعتقل 9 بينهم 4 سيدات بتهمة الإضرار بالأمن,اعتقال 9 بينهم 4 سيدات بتهمة الإضرار بالأمن فى السعودية,agree
بين الماء والنار: إيران في عين العاصفة,إيران وسط العاصفة بين الماء و النار,agree
بالصور: فيضانات قوية تقتل 5 أشخاص في تونس,فيضانات عنيفة تقتل 5 أشخاص بالمغرب,disagree
تمجيد الزعيم على الطريقة الصينية,كيف يمجد الصينيون الزعماء ؟,agree
اغلاق أبواب كنيسة القيامة احتجاجا على إجراءات ضريبية إسرائيلية,كنيسة القيامة تفتح أبوابها للجميع,disagree
حكم بحبس هشام جنينة خمس سنوات,مصر: براءة هشام جنينة,disagree
الحرب في سوريا: القوات الحكومية تشن هجوما من خمسة محاور على الغوطة الشرقية,أعلنت الحكومة السورية عن توقف الهجوم على الغوطة الشرقية,disagree
الرئيس الفلسطيني يعتذر رسميا بعد تصريحات عن محارق اليهود,إعتذار الرئيس الفلسطيني بعد تصريحاته عن محارق اليهود,agree
صفعة جديدة للاقتصاد القطري.. سقوط الصفقة الثلاثية,الصفقة الثلاثية تسقط وقطر تتلقى صفقة مدوية,agree
الدولار عند أعلى مستوى وهبوط للإسترليني,صعود كبير للإسترليني وهبوط حاد للدولار,disagree
وسط ترنح الليرة.. المركزي التركي يتخذ خطوة تفوق التوقعات,الليرة تستقر والمركزي التركي يقف صامتا,disagree
مصر.. ارتفاع قياسي جديد للاحتياطي الأجنبي,زيادة قياسية للاحتياطي الاجنبي في مصر,agree
مسيرة صعود هارفي واينستين إلى العالمية وسقوطه المدوي,مسيرة صعود هارفي واينستين إلى العالمية,disagree
امرأة في السودان تواجه الإعدام شنقا بعدما قتلت زوجها المغتصب,امرأة سودانية تواجه شبح الإعدام شنقا بعدما قتلت زوجها اثناء اغتصابه لها,agree
تعرف على أهم بنود الاتفاق النووي الإيراني,إيران تلغي الاتفاق النووي,disagree
الدولار ينزل بعد هبوط الأسهم الأميركية,الأسهم الأميركية ترتفع بالدولار,disagree
المجلس الأعلى للإعلام في مصر: مسلسل أبو عمر المصري لا يسيء للسودان,المجلس الأعلى للإعلام في مصر يوقف مسلسل أبو عمر المصري,disagree
ارتفاع أسعار الذهب لأعلى مستوياته,انخفاض على أسعار الذهب مع ارتفاع في قيمة الدولار,disagree
تشريح جثتي سائحي الغردقة بعد أوامر من النيابة المصرية,النيابة المصرية تأمر بتسليم جثتي سائحي الغردقة البريطانيين,disagree
صعود لليرة قبل محاكمة برونسون,الليرة تواصل الهبوط رغم الأنباء عن اتفاق بشأن القس برونسون,disagree
مدعية المحكمة الجنايات الدولية تطالب بإنهاء العنف في غزة,محكمة الجنايات الدولية تطالب بوقف العنف في غزة,agree
طلب فلسطيني للمحكمة الجنائية الدولية بالتحقيق في جرائم ارتكبتها إسرائيل,المحكمة الجنائية الدولية تتلقى طلب فلسطيني بالتحقيق في جرائم ارتكبتها إسرائيل,agree
رحلة للتاريخ بين لندن وبيرث,رحلة تاريخية بين مدينتي لندن وبيرث,agree
