s1,s2,stance
أمريكا في انتظار الندم التاريخي إذا قامت بالانسحاب من اتفاق إيران النووي,أمريكا تتطلع لحدث تاريخى بالانسحاب من اتفاق إيران النووي,disagree
إيقاف عملية البحث عن مغن ألماني فقد قبالة الشواطئ الكندية,التوقف عن البحث عن المغني الألماني الذي فُقد قرابة الشواطئ الكندية,agree
السعودية: فتح باب القبول أمام الفتيات للوظائف العسكرية,السعودية ترفض قبول الفتيات فى الوظائف العسكرية,disagree
السعودية والإمارات والكويت تدعم الأردن بمليار دولار,الأردن تقدم مليون دولار لثلاث دول خليجية,disagree
أوروبا تحظر واردات اللحوم من 20 مصنعا بالبرازيل,اقصاء لواردات 20 مصنع بن برازيلي من أوروبا,disagree
تركيا تواجه أزمة الليرة.. برفع أسعار الكهرباء,ألمانيا تسعى لرفع الليرة بزيادة أسعار الكهرباء,disagree
الصين ترد على ترامب.. برفع رسوم الاستيراد,الصين ترد بخفض الجمارك على واردات أميركية,disagree
الذهب يرتفع مدعوما بتراجع الدولار,تراجع للدولار وصعود للذهب,agree
السعودية تعتقل وتمنع من السفر المزيد من ناشطات حقوق الإنسان,السعودية تعتقل المزيد من ناشطات حقوق الإنسان,agree
استبعد روحانى تقديم حكومته استقالتها بسبب الاحتجاجات على الوضع الاقتصادى,روحانى يطالب حكومته بتقديم استقالتها سوء الوضع الاقتصادى,disagree
النفط يتراجع مع تضرر السوق من تصاعد التوترات التجارية,التوترات التجارية تضر بالأسواق وتهبط بالنفط,agree
الجيش الإيراني: لن ننتظر إذن واشنطن لتطوير قدراتنا الدفاعية,الجيش الإيراني يخاطب واشنطن لتطوير قدراته الدفاعية,disagree
قفزة كبيرة في إيرادات مصر من السياحة,إيرادات السياحة المصرية لأعلى مستوى,agree
مغربية تكتشف أصولها الأمازيغية بالرسم,مغربية تكتشف أصولها المصرية بالرسم,disagree
السعودية: فتح تحقيق مع كاتب يشكو من كثرة عدد المساجد وينتقد إزعاج الأذان,كاتب يدعم كثرة عدد المساجد ويطلب رفع صوت الأذان,disagree
مصر تحقق أفضل تصنيف ائتماني في 7 سنوات,تحقيق أفضل تصنيف ائتماني لمصر في ٧ أعوام,agree
كيف احتفت مغنية راب سعودية بقيادة المرأة للسيارة,مغنية راب سعودية تحتفل بقيادة المرأة للسيارة,agree
الإصدار الأول لصكوك أندونيسيا الخضراء بأكثر من مليار دولار,الصكوك الماليزية الخضراء بما يقل عن مليار دولار,disagree
أزياء لا كالأزياء .. في انتخابات تونس,أزياء الانتخابات التونسية,agree
النفط يهبط إلى أدنى مستوياته,صعود حاد لأسعار النفط,disagree
ارتفاع إيرادات قناة السويس في يوليو,يوليو: إيرادات قناة السويس تنخفض,disagree
مخترع بتكوين مهدد بدفع تعويضات قدرها 10مليارات دولار,بتكوين مطالبة بـ 10 مليار دولار,agree
دعوات من المملكة إلى اجتماع رباعي لدعم الأردن,مصر تدعو إلى اجتماع رباعي لدعم الأردن,disagree
ما هي أهم بنود الاتفاق النووي الإيراني؟,تعرف على أهم بنود الاتفاق النووي الإيراني,agree
مجلس الأمن يؤجل التصويت على الهدنة الإنسانية في سوريا,الهدنة الإنسانية في سوريا تؤجل بقرار من مجلس الأمن,agree
السلطات الماليزية تجري تشريحا على جثمان البطش,جثمان البطش يتعرض للتشريح من قبل السلطات الماليزية,agree
رئيس تركيا يلمح بضرب شمال العراق ما لم يتم تطهير بغداد من المسلحين الأكراد,رئيس تركيا يرفض ضرب شمال العراق,disagree
وزير الطاقة الإماراتي: قريبون من بلوغ الاتزان في سوق النفط,طاقة الإمارات تلوح بالتوصل للحد المطلوب بانتاج النفط,agree
بي بي سي تلجأ للأمم المتحدة لحماية صحفييها في الخدمة الفارسية,الأمم المتحدة تتولى مهمة حماية بي بي سي في الخدمة الفارسية,agree
النزاع في سوريا: اتفاق أمريكي تركي على تجنب الصدام في منبج,قامت أمريكا بالاتفاق مع تركيا من أجل حل نزاع منبج,agree
في ظل كارثة الليرة.. ضربة جديدة للاقتصاد التركي,مشاكل جديدة للاقتصاد العالمي بعد أزمة الليرة,disagree
الصين: الولايات المتحدة تُضر نفسها,واشنطن: الصين تضر نفسها,disagree
تدهور وشيك على اقتصاد الجمهورية الإسلامية,نمو الاقتصاد الإيراني قريبا,disagree
وزير الخارجية اليمني: لا نخطط لتدمير البنية التحتية,وزير خارجية اليمن: لا توجد نية لتدمير البنية التحتية,agree
بين الماء والنار: إيران في عين العاصفة,هدوء الأوضاع فى إيران,disagree
انخفاض قياسي جديد لليرة التركية,الليرة ترتفع,disagree
الأمم المتحدة: 270 ألف نازح بسبب القتال في جنوب غربي سوريا,مذات الآلاف من النازحين السوريين إثر القتال الناشب جنوب غرب سوريا,agree
العراق تعلن مصادرة ممتلكات الرئيس السابق صدام حسين وآلاف من المسؤولين السابقين,العراق تنفي مصادرة ممتلكات الرئيس السابق صدام حسين,disagree
وزير الداخلية الألماني يرفض طلبا نقابيا بزيادة الرواتب,قبول لطلب نقابي بزيادة الرواتب في ألمانيا,disagree
مشروع عملاق في قناة السويس.. و50 ألف فرصة عمل,مشروع جديد يوفر ٥٠ الف فرصة عمل في قناة السويس,agree
الممثلة كلير فوي تكشف عن صراعها مع القلق النفسي منذ طفولتها,الممثلة كلير فوي تكشف عن صراعها مع السرطان منذ طفولتها,disagree
نزيف الليرة التركية مستمر بعد العقوبات الأميركية,الليرة التركية تواصل الهبوط جراء العقوبات الأميركية,agree
موت مريم مصطفى: نيابة مدينة روما تفتح تحقيقا في القضية,فتح تحقيق في قضية موت مريم مصطفى في مدينة باريس,disagree
سندات أكتوبر وتراجع الليرة يهزان الاقتصاد التركي,تعافي الليرة وسندات مالية تدفعان الاقتصاد التركي,disagree
من يحسم سباق التريليون دولار أولا؟,من يصل للتريليون يورو أولاً ؟,disagree
إسرائيل تسقط طائرة مقاتلة سورية من نوع سوخوي فوق الجولان,إسرائيل تفشل فى اسقاط طائرة مقاتلة سورية فوق الجولان,disagree
مصر.. رد حكومي على إضافة مادة للخبز تقلل السكان,مصر  تتجاهل الرد بشأن مادة تقلل السكان,disagree
النقد الدولي: نمو الاقتصاد العالمي بدون تغيير,صندوق النقد:الاقتصاد العالمي في مكانه,agree
سحب الفيلم الصيني الأغلى تكلفة من دور العرض بسبب صعف إيراداته,الفيلم الصيني الأغلى تكلفة يُسحب من دور العرض لضعف وارداته المادية,agree
الحرب في سوريا: روسيا تقدم شهودا على أن الهجوم الكيمياوي المزعوم في دوما مسرحية,روسيا تقدم شهودا بشأن الهجوم الكيمياوى فى دوما و تصفه بالمسرحية,agree
الخارجية الأميركية تؤكد التوجه لفرض عقوبات على إيران,خارجية الولايات المتحدة تنفي التوجه لفرض عقوبات على إيران,disagree
الصين تستعد لإطلاق قطار هايبرلوب بسرعة صاروخية,قطار هايبرلوب ذو السرعة الصاروخية قريباً في الصين,agree
السعودية تفتتح أول دار عرض سينمائي منذ 40 عاما,أول سينما في السعودية بعد أكثر من 40 عام,agree
هبوط للجنيه الاسترليني بعد استقالة جونسون,ارتفاع للجنيه الاسترليني باستقالة جونسون,disagree
قصف إيرانى للبوكمال فى سوريا بعد هجوم الأهواز,سوريا: توقف القتال فى البوكمال,disagree
اكتشاف جديد: قبر فرعوني يحتوي على جبن عمره 3200 سنة,اكتشاف جديد: قبر فرعوني يحتوي على فول عمره 3200 سنة,disagree
مجلس الأمن يؤجل التصويت على الهدنة الإنسانية في سوريا,مجلس الأمن يُصوت على الهدنة الإنسانية في سوريا,disagree
تمثال رمسيس الثاني يوضع أخيراً في بهو المتحف المصري الكبير,تمثال رمسيس الأول يوضع أخيراً في بهو المتحف المصري الكبير,disagree
التحالفات النهائية التي تخوض انتخابات مجلس النواب في العراق,تمت إدارة إنتخابات مجلس النواب في العراق من قبل التحالفات النهائية,agree
الضربة الوشيكة تقفز بأسعار النفط إلى مستوى قياسي,قفزة للنفط قبيل توجيه ضربة لسوريا,agree
البريطانية آنا بيرنز تفوز بجائزة مان بوكر المرموقة عن روايتها بائع الحليب,جائزة مان بوكر المرموقة من نصيب البريطانية آنا بيرنز عن روايتها بائع الحليب,agree
تراجع الاحتياطي الدولي والسيولة الأجنبية لـقطر المركزي,وفرة في السيولة النقدية الأجنبية في قطر,disagree
رفع أسعار الفائدة يرفع الدولار لأعلى مستوى,توقعات خفض أسعار الفائدة يهبط بالدولار,disagree
النفط يهبط وسط مخاوف من تصاعد الخلاف التجاري,النفط يرتفع رغم مخاوف الخلاف التجاري,disagree
محادثات سعودية إماراتية كويتية لدعم البحرين,السعودية و الإمارات و الكويت يتحادثون بشأن دعم البحرين,agree
النفط مستمر بالصعود              ,هبوط متواصل للنفط,disagree
سقوط طائرة عسكرية أمريكية غربي العراق,العراق: سقوط مروحية عسكرية أمريكية غربى البلاد,agree
جلد رجل إيراني 80 جلدة لشربه الخمر حين كان طفلا,الحكم بالجلد على رجل إيراني شرب الخمر في صغره,agree
السعودية تفتح باب القبول للوظائف العسكرية أمام الفتيات,السعودية ترفض قبول الفتيات فى الوظائف العسكرية,disagree
احتجاجات شعبية على سوء جودة المياه جنوب غربي إيران,المواطنون يشيدون بحسن جودة المياه جنوب غربي إيران,disagree
صرح الجيش الإيراني بأنه لن ينتظر الإذن من واشنطن لتطوير قدراته الدفاعية,الجيش الإيراني يخاطب واشنطن لتطوير قدراته الدفاعية,disagree
جبهة تحرير سوريا أخر تشكيلات المعارضة,تعد جبهة تحرير سوريا هي اول جبهة معارضة,disagree
الغارات الجوية على الغوطة الشرقية لم تكن بغاز الكلور,مصدر: الغارات على الغوطة الشرقية لم تكن بغاز الكلور,agree
نيتا المغنية الإسرائيلية تفوز بجائزة اليورفيجن 2018,نيتا المغنية الإسرائيلية تفوز بجائزة اليورفيجن 2020,disagree
الأمم المتحدة: يجب أن يتحرك العالم سريعا لانقاذ اليمن من براثن أسوأ أزمة انسانية,الأمم المتحدة تتجاهل أسوأ أزمة انسانية فى اليمن,disagree
مقتل الشابة حياة فى البحر سبب صدمة كبيرة فى أرجاء المغرب وسط تفشي إشاعة فونطوم,نجاة الشابة حياة من القتل فى المغرب,disagree
مصر تعلن نسبة تراجع معدل البطالة,تراجع نسبو البطالة في مصر,agree
تعرف على تفاصيل قانون يهودية دولة إسرائيل,الشرح المفصل ليهودية دولة اليمن,disagree
الذهب ينخفض مع فشل أزمة إيران في تحفيز المشتريات,فشل أزمة إيران في تحفيز المشتريات يؤدي إلى انخفاض الذهب,agree
تقليص توقعات نمو الطلب العالمي على النفط,اوبك ترفع توقعاتها بشأن نمو الطلب العالمي,disagree
انتقادات لاذعة لظهور صورة لجنود إسرائيليين على لوحة إعلانات بمدينة شيراز في إيران,انتقادات شديدة بعد وضع صورة لجنود إسرائيليين على لوحة إعلانات بمدينة شيراز الإيرانة,agree
الصين ترد على ترامب.. برفع رسوم الاستيراد,الصين ترفع رسوم الاستيراد على البضائع الأميركية,agree
غموض بشأن مصير الإعلامي السعودي جمال خاشقجي,تم الإعلان عن العثور على جمال خاشقجي,disagree
عقود النفط الأميركي تهبط بنسبة 2%,عقود النفط السعودي تهبط بنسبة 2%,disagree
فينوسا الإسبانية تطالب بأربعة مليارات من مصر,مصر ترفع دعوى قضائية فينوسا,disagree
ترامب و زوجته من بين حضور حفل افتتاح السفارة الأمريكية في القدس,ترامب و زوجته يغيبان عن حضور حفل افتتاح السفارة الأمريكية في القدس,disagree
دعت هيومن رايتس ووتش دبي أن تقوم باعلان مصير ابنة حاكم الإمارة,هيومن رايتس ووتش تتجاهل مخاطبة دبي باعلان مصير ابنة حاكم الإمارة,disagree
رئيس الوزراء الإثيوبي: مشروع سد النهضة قد لا يرى النور قريبا,رئيس الوزراء الإثيوبي يعلن ظهور مشروع سد النهضة قريبا,disagree
التحقيق في مقطع فيديو لـقناصة إسرائيليين يحتفلون بإطلاق النار على فلسطيني أعزل,تم تداول فيديو لجنود إسرائيليين أطلقوا النار على شاب أعزل,agree
كنيسة القيامة تغلق أبوابها احتجاجا على إجراءات ضريبية إسرائيلية,كنيسة القيامة تفتح أبوابها للجميع,disagree
مدير أكاديمية الأوسكار يواجه اتهامات بالتحرش,اتهامات بالتحرش تنال من مدير أكاديمية ام اي تي,disagree
تراجع نسبو البطالة في مصر,البطالة لأعلى مستوى في مصر,disagree
هشام عشماوى فى قبضة السلطات المصرية,السلطات المصرية تفشل فى القبض على هشام عشماوى,disagree
الذهب يصعد قبل شهادة باول,ارتفاع على الذهب قبل شهادة باول,agree
كوريا الشمالية تدعم سوريا بمواد قد يتم استخدامها لإنتاج أسلحة كيماوية,كوريا الشمالية ترفض دعم سوريا,disagree
إقالة محافظ البنك المركزي الإيراني وسط صعوبات اقتصادية كبيرة,إستمرار محافظ البنك المركزي الإيراني فى منصبه,disagree
الحكومة المصرية ترفع أسعار الوقود,أسعار الوقود ترتفع في مصر,agree
مصر تعلن حجم استثمارات الأجانب في أدوات الدين,إعلان سعودي عن حجم استثمارات أجنبية في أدوات الدين,disagree
استقالة مستشار الرئيس الأمريكي للأمن الداخلي,استمرار مستشار الرئيس الأمريكي للأمن الداخلي فى منصبه,disagree
تعليق مفاجئ للمشاريع الروسية في إيران,لوك أويل تستمر في مشاريعها الإيرانية,disagree
الليرة التركية تخسر الكثير أمام الدولار,الليرة التركية تواصل الصعود أمام الدولار,disagree
تعرف على عشيرة الغفران التي تشكو سحب قطر الجنسية من أبنائها,ما هى عشيرة الغفران التى تشكو سحب الجنسية من أبنائها فى قطر ؟,agree
الخلاف التجاري يهبط بالنفط,النفط يرتفع رغم مخاوف الخلاف التجاري,disagree
جنوب السودان انفصال له تبعاته,تداعيات الانفصال شرق السودان تستمر,disagree
تسليم ٢٥ مدرسة للقطاع الخاص في المملكة السعودية,استلام ٢٥ مدرسة للقطاع العام بالسعودية,disagree
المركزي التركي يخالف التوقعات.. والليرة تدفع الثمن,البنك المركزي التركي يسبب خسائر في قيمة الليرة,agree
السيولة النقدية الأجنبية تتراجع في مركزي قطر,وفرة في السيولة النقدية الأجنبية في قطر,disagree
ندّدت غزة بجريمة قتل الشابة رزان النجار على يد إسرائيل,ساد الصمت شوارع غزة بعد مقتل المسعفة رزان النجار,disagree
واشنطن تلاحق مصارف عراقية جديدة,العراق تلاحق مصارف أميركية,disagree
205 مذكرات توقيف لعناصر في شبكة تهريب في ليبيا,توقيف عناصر فى شبكة تهريب فى ليبيا بعد ورود 205 مذكرة بحقهم,agree
اليمن: معارك الحديدة تسفر عن مقتل العشرات خلال أيام,اليمن: معارك قوية فى الحديدة دون وقوع ضحايا,disagree
هل تجاهل أردوغان حقا أزمة بلاده الاقتصادية؟,أردوغان يعترف بالأزمة الاقتصادية لبلده,disagree
تغييرات واسعة فى قيادات كبرى بالجيش فى السعودية,لا تغييرات فى قيادات الجيش فى السعودية,disagree
إطلاق سراح معتقل سعودي من سجن غوانتانامو الأمريكي,الولايات المتحدة تطلق سراح معتقل سعودي من أبو غريب,disagree
قطر تقاضي الإمارات أمام محكمة العدل الدولية بشأن انتهاكات لحقوق الإنسان,قطر تشيد بالإمارات فى مجال حقوق الإنسان,disagree
مسيرات غزة: مقتل المسعفة الفلسطينية الشابة رزان النجار جريمة اغتيال إسرائيلية مكتملة الأركان,ندّدت غزة بجريمة قتل الشابة رزان النجار على يد إسرائيل,agree
إغلاق موقع إلكتروني والقبض على رئيس تحريره في مصر لأسباب إدارية,اخلاء سبيل رئيس تحرير موقع إلكتروني وعودة العمل بالموقع,disagree
مصر.. رسوم جمركية جديدة للتشجيع والاستغناء,وقف جمارك مصرية على سلع ليس لها بدائل محلية,disagree
4 دول عربية بين الـ6 الأغنى في أفريقيا,قائمة الأغنى إفريقيا تخلو من الدول العربية,disagree
تقوم الحكومة السورية بمحاصرة الغوطة الشرقية,أعلنت الحكومة السورية عن توقف الهجوم على الغوطة الشرقية,disagree
الرئيس الإيراني حسن روحاني يقيل محافظ البنك المركزي وسط صعوبات اقتصادية جمة,إقالة محافظ البنك المركزي الإيراني وسط صعوبات اقتصادية كبيرة,agree
الخارجية الإيرانية تهدد بإجراءات مضادة إذا أوقفت الولايات المتحدة صادرات إيران النفطية,الخارجية الإيرانية لا تدعم الرد ضد الولايات المتحدة فى حالة منع صادرات إيران النفطية,disagree
المغني الأمريكي آر كيلي يقيم حفلا وسط احتجاجات ضد سلوكه الجنسي,رغم الاحتجاج على سلوكة الجنسي، المغني الأمريكي آر كيلي يقيم حفلاً غنائياً,agree
انطلاق أولى رحلات قطار الحرمين السريع في السعودية,وقف قطار الحرمين في السعودية,disagree
المركزي المصري يعلن مبادرة لإسقاط ديون المتعثرين,مبادرة للبنك المركزي المصري لإسقاط ديون المتعثرين,agree
انخفاض لسعر النفط قبل عقد اجتماع أوبك,انخفاض لسعر الدولار قبل عقد اجتماع أوبك,disagree
السيستاني يدعو إلى تشكيل حكومة عراقية جديدة في أقرب وقت,السيستاني يرفض تشكيل حكومة عراقية جديدة,disagree
حذرت تركيا فرنسا من السير على نهج الولايات المتحدة فى سوريا,تركيا تدعو فرنسا للسير على خطى الولايات المتحدة فى سوريا,disagree
وزير النفط العراقي: تلقينا أكثر من 90 عرضا لخط أنابيب كركوك,أكثر من ٩٠ عرضا للنفط شمال العراق,agree
تركيا.. التضخم في أعلى مستوى منذ 15 عاما,تسجيل ادنى مستوى للتضخم في تركيا منذ ١٥ عاما,disagree
اتفاق لتنظيم العمالة بين الكويت والفلبين,تنظيم العمالة الفلبينية في الكويت,agree
أعلى مرجع شيعي يحض العراقيين على عدم انتخاب الفاشلين والفاسدين في الانتخابات النيابية,مرجع شيعى يجيز انتخاب الفاشلين !,disagree
كندا تنتقم من ترامب,انتقام ترامب من دولة مجاورة,disagree
جائزة الدب الذهبي في مهرجان برلين السينمائي تذهب للفيلم الروماني  لا تلمسني ,جائزة الدب الذهبي في مهرجان برلين السينمائي تذهب للفيلم البلجيكي لا تلمسني ,disagree
روسيا استغلت هوس المونديال لتمرير قرار يمس الملايين,الحوثيون ينهبون الملايين.. بذريعة نقود الشرعية,other
الدولار يحلّق واليورو يهبط بسبب الليرة التركية,زيادة في سعر الدولار و انخفاض لسعر اليورو بسبب الليرة التركية,agree
بكين: سنقاتل حتى النهاية في أي حرب تجارية تطلقها واشنطن,روسيا مستعدة لأي حرب تجارية ضد واشنطن,disagree
مشروبات كحولية فاسدة تقتل العشرات في إيران,مشروبات كحولية فاسدة تقتل المئات في إيران,disagree
المغرب.. توقعات بانخفاض عجز موازنة 2019,تضاؤل عجز الموازنة المغربية في ٢٠١٩,agree
الطاهي والنجم التلفزيوني الشهير أنتوني بوردين وُجد ميتاً و تدور الشكوك حول انتحاره,الطاهي والنجم التلفزيوني الشهير أنتوني بوردين وُجد مقتولا,disagree
