s1,s2,stance
محطات في حياة الممثل الراحل جميل راتب,وقفات في حياة المغني الراحل جميل راتب,disagree
قبل اجتماع يونكر وترامب.. تحذير ألماني لواشنطن,الرئيس الأميركي يوجه تهديدات لألمانيا قبل لقائه يونكر,disagree
العام فى قطر، حلو و مرّ,عام صعب فى قطر,disagree
اتهام ضباطا في السلطة بمحاولة اغتيال الحمد الله في غزة,براءة ضباطا في السلطة من تهمة محاولة اغتيال الحمد الله في غزة,disagree
جيرار ديبارديو الممثل الفرنسي الشهير يُتهم باغتصاب ممثلة شابة,جيرار ديبارديو الممثل الفرنسي الشهير يُتهم بقتل ممثلة شابة,disagree
سفينة لمكافحة قرصنة من كوريا الجنوبية تبحر إلى ليبيا لإنقاذ مهندس مخطوف,كوريا الجنوبية تتجاهل مهندس مخطوف في ليبيا,disagree
اعتقال إيرانية تعيش في بريطانيا منذ 10 سنوات خلال زيارتها للبلاد,تعرض إيرانية تعيش في بريطانيا منذ 10 سنوات للاعتقال عند زيارتها للبلاد,agree
تونس تقول إنه ليس لديها خطط لإعادة مشتبه بكونه حارس بن لادن إلى ألمانيا,تونس تنفى وجود خطط لإعادة مشتبه بكونه حارس بن لادن إلى ألمانيا,agree
أعلى مرجع شيعي يحض العراقيين على عدم انتخاب الفاشلين والفاسدين في الانتخابات النيابية,مرجع شيعى: لا لانتخاب الفاشلين و الفاسدين فى الانتخابات النيابية,agree
من هي ناتالي بورتمان التي رفضت جائزة إسرائيلية بسبب غزة؟,ناتالي بورتمان ترفض جائزة إسرائيلية بسبب غزة,agree
استقالة مستشار الرئيس الأمريكي للأمن الداخلي,مستشار الرئيس الأمريكي للأمن الداخلي يقدم استقالته,agree
الأسد يزور الغوطة الشرقية ومفاوضات لإجلاء الفصائل المسلحة,زيارة الأسد للغوطة الشرقية: مفاوضات من أجل ابعاد الفصائل المسلحة,agree
إعادة فرض حظر التجول بعد مقتل متظاهر في احتجاجات البصرة,فرض حظر التجول من جديد بعد مقتل متظاهر في احتجاجات البصرة,agree
تنظيم العمالة الفلبينية في الكويت,الكويت ترفض تنظيم العمالة الفلبينية,disagree
100 ألف برميل يخسرهم الإنتاج الليبي يوميا بعد هجوم إرهابي,20 ألف برميل يخسرهم الإنتاج الليبي يوميا بعد هجوم إرهابي,disagree
تصريحات غاضبة متبادلة بين ترامب و روحانى,هدوء الأوضاع بين ترامب و روحانى,disagree
الذهب يرتفع مع ضعف الدولار,ارتفاع الدولار يهبط بأسعار الذهب,disagree
في تحد لترامب، إيران تكشف عن طائرة مقاتلة جديدة محلية الصنع,إيران تتحدى ترامب و تكشف عن طائرة مقاتلة جديدة محلية الصنع,agree
روسيا تشن أول غارة جوية على جنوبي سوريا منذ هدنة 2017,روسيا بدون غارات جوية على سوريا منذ هدنة 2017,disagree
كوالالمبور: سوري عالق فى المطار لأكثر من شهر,حل أزمة السوري العالق في مطار كوالالمبور,disagree
السعودية وكندا: المملكة تطرد السفير الكندي وتجمد كل التعاملات التجارية الثنائية الجديدة,السفير الكندي فى السعودية يباشر عمله,disagree
الذهب يتراجع من أعلى مستوى في 5 أسابيع,تراجع لأسعار الذهب من أعلى مستوى في خمسة أسابيع,agree
روسيا: مفتشو منظمة حظر الأسلحة الكيماوية غادروا دمشق متوجهين إلى دوما,أعلنت روسيا مغادرة مفتشو منظمة حظر الأسلحة الكيماوية دمشق متجهين إلى دوما,agree
إنتاج ليبيا النفطي يخسر 100 ألف برميل يوميا بعد هجوم إرهابي,100 ألف برميل يخسرهم الإنتاج الليبي يوميا بعد هجوم إرهابي,agree
20 قتيلا في غارات على الحديدة اليمنية,غارات على الحديدة فى اليمن دون سقوط ضحايا,disagree
برنت يغلق مستقرا والخام الأميركي يرتفع,انخفاض برنت عند الاغلاق و ارتفاع للخام الأمريكي,disagree
إيران وسط العاصفة بين الماء و النار,هدوء الأوضاع فى إيران,disagree
مقتل العشرات فى معارك الحديدة فى اليمن,اليمن: معارك قوية فى الحديدة دون وقوع ضحايا,disagree
تم التوصل إلى اتفاق يشمل خروج جيش الإسلام من الغوطة فى سوريا,فشل اتفاق خروج جيش الإسلام من الغوطة فى سوريا,disagree
مفوضية اللاجئين تطالب إسرائيل بإعادة النظر في قرارها بشأن اللاجئين الأفارقة,مفوضية اللاجئين تأمل أن تعيد أمريكا النظر في إلغائها لاتفاق إعادة توطين اللاجئين الأفارقة,disagree
حريق تسبب في سقوط الطائرة المصرية فوق المتوسط في 2016,سقوط الطائرة المصرية فوق البحر المتوسط فى 2016 كان بسبب حادث مدبر,disagree
الحرب في سوريا: الرئيس الروسي يأمر بوقف إنساني للقتال في الغوطة الشرقية,أمر الرئيس الروسي بوقف إنساني للقتال في الغوطة الشرقية فى سوريا,agree
الحرب التجارية بين الصين وأميركا تهبط بالدولار,هبوط للدولار بفعل حرب الصين_أميركا التجارية,agree
تراجع التضخم في مصر,التضخم يتراجع في مصر,agree
الدولار يقفز قبيل إعلان الأربعاء,انخفاض يكتسح الدولار بعد إعلان الأربعاء,disagree
اعتذار من بي بي سي للمذيعة كاري غراسي بشأن الراتب,اعتذار من بي بي سي للمذيعة كاري غراسي بشأن الترقية,disagree
اليمن: معارك الحديدة تسفر عن مقتل العشرات خلال أيام,مقتل العشرات فى معارك الحديدة فى اليمن,agree
وزير الخارجية اليمني: لا نخطط لتدمير البنية التحتية,وزير الخارجية اليمني: نخطط لتدمير البنية التحتية,disagree
تحقيق أفضل تصنيف ائتماني لمصر في ٧ أعوام,مصر تتراجع في التصنيف الائتماني,disagree
مصر تجري تقييما مرحليا للمشاريع السياحية قيد التنفيذ,المشاريع السياحية المصرية تحت التقييم,agree
السودان: استبدال رئيس الأركان ضمن تغييرات في قيادات الجيش,بقاء رئيس الأركان السوداني فى منصبه,disagree
الذهب يتراجع مع تصريحات ترامب حول كوريا الشمالية,تصريحات ترامب حول كوريا الشمالية تخفض أسعار الذهب,agree
إبطال زواج طفلة عمرها 11 عاما فى السودان,محكمة سودانية تقضي بصحة زواج طفلة عمرها 11 عاما,disagree
كيف تبقي واشنطن على التعاون التركي الإيراني الروسي حيا في سوريا؟,كيف تحافظ واشنطن على التعاون التركي الإيراني الروسي في سوريا؟,agree
كيف بدت ردود الفعل عربياً وعالمياً على أحداث غزة؟,هدوء عربي وعالمي بعد أحداث غزة,disagree
اللاجئون السوريون يخشون خسارة أردوغان وحزبه الانتخاباب الوشيكة,اللاجئون السوريون واثقون فى فوز أردوغان وحزبه بالانتخابات القادمة,disagree
روحاني يتهم واشنطن بالسعي لتغيير نظام الحكم في إيران,أتهم روحانى واشنطن بالسعى لتغيير نظام الحكم الإيرانى,agree
غرق عشرات المهاجرين قبالة سواحل اليمن,نجاة شرات المهاجرين من الغرق لغرق قبالة سواحل اليمن,disagree
الليرة التركية تهبط إلى مستوى قياسي جديد أمام الدولار,ارتفاع الليرة التركية مقابل الدولار,disagree
الجزائر تؤكد ظهور 41 حالة إصابة بالكوليرا في أربع ولايات,الجزائر تعلن إصابة 41 حالة بالكوليرا في أربع ولايات,agree
اللاجئون السوريون قلقون من خسارة أردوغان وحزبه الانتخابات القادمة,اللاجئون السوريون واثقون فى فوز أردوغان وحزبه بالانتخابات القادمة,disagree
بوتن يرفع راية الإصلاح الاقتصادي بولايته الرابعة,رئيس روسيا في ولايته الرابعة يتفادى الإصلاحات الاقتصادية,disagree
محمد بن سلمان يزور الكويت وسط توقعات بمناقشة الأزمة الخليجية,زيارة لمحمد بن سلمان إلى الكويت مع توقعات بمناقشة أزمة الخليج,agree
وزارة الصحة: مقتل 3 فلسطينيين في مظاهرات غزة اليوم,الجيش الأمريكي يعلن مقتل إرهابيين اثنين في غارة جوية جنوبي ليبيا,other
إسرائيل: لن نفرق بين الدولة اللبنانية وحزب الله في أي حرب في المستقبل,إسرائيل: هناك فرق كبير بين الدولة اللبنانية وحزب الله,disagree
حكاية نازانين زاغاري البريطانية المتهمة بالتجسس في إيران,تعرف على نازانين زاغاري البريطانية المتهمة بالجاسوسية فى إيران,agree
إيران: احتجاجات كبيرة في عدة مدن سبب الأوضاع الاقتصادية الصعبة,إنتعاش الاقتصاد الإيراني,disagree
لماذا تعترف إسرائيل الآن بتدمير المفاعل النووي السوري؟,إسرائيل تنكر تدمير المفاعل النووي السوري,disagree
مع تدهور الليرة.. تركيا تعلن غدا عن نموذج اقتصادي جديد,اقتصاد تركيا تنفي طرح نموذج اقتصادي جديد,disagree
أردوغان يبدأ ولاية رئاسية جديدة بصلاحيات غير مسبوقة,يبدأ أردوغان ولاية جديدة فى الرئاسة بصلاحيات كبيرة غير مسبوقة,agree
مصر.. وفرة السكر تفرض قرارا عاجلا على الحكومة,قرار حكومي مصري عاجل بسبب وفرة السكر,agree
رحلة تاريخية بين مدينتي لندن وبيرث,رحلة تاريخية بين لندن وبرلين,disagree
اتهام للسعودية باعتقال مواطن قطري والإعلام السعودي يصفه بأنه ضابط مخابرات,السعودية تنفي اعتقال مواطن قطري,disagree
إطلاق تطبيق على الهاتف المحمول لتقييم الخطب الدينية فى السعودية,رفض قاطع لتطبيق على الهاتف المحمول لتقييم الخطب الدينية فى السعودية,disagree
تحذيرات ألمانية من حرب ترامب التجارية,ترامب يحذر ميركل من الحرب التجارية,disagree
الحرب في اليمن: تنظيم الدولة الإسلامية يتبنى هجوما مزدوجا في عدن,هجوم مزدوج على عدن باليمن و تنظيم الدولة الإسلامية يتبنى الهجوم,agree
قفزة ضخمة في تحويلات المصريين بالخارج,المصريون المغتربون يسببون قفزة بالتحويلات لبلدهم,agree
من هم العرب الذين حصلوا على جائزة نوبل للسلام؟,من هم العرب الذين حصلوا على جائزة نوبل للطب؟,disagree
مرجع شيعى: لا لانتخاب الفاشلين و الفاسدين فى الانتخابات النيابية,مرجع شيعى يجيز انتخاب الفاشلين !,disagree
أجهضت 12 مرة بإرادتها في بلد عربي يكفل حق الإجهاض,سيدة أجهضت 12 مرة بكامل إرادتها فى بلد عربى لا يجرم ذلك,agree
سيدة أجهضت 12 مرة بكامل إرادتها فى بلد عربى لا يجرم ذلك,سيدة تواجه المحاكمة بتهمة الاجهاض,disagree
محكمة العدل الدولية تبحث دعوى إيران لتعليق العقوبات الأمريكية,محمكة العدل الدولية تناقش مطالب إيران بوقف العقوبات الأمريكية,agree
السعودية تدعو إلى اجتماع رباعي لدعم الأردن,مصر تدعو إلى اجتماع رباعي لدعم الأردن,disagree
محكمة عسكرية مصرية تقضي بحبس هشام جنينة خمس سنوات,حكم بحبس هشام جنينة خمس سنوات,agree
خامنئي يعترف: خطأ فادح السبب في مشكلات إيران,خامنئي يرفض الاعتراف بوجود أي خطأ,disagree
الإعلان عن سقوط طائرة تركية عائدة من الإمارات,الإعلان عن تحطم طائرة يمنية عائدة من الإمارات,disagree
السعودية طردت 17 ألف مهاجر يمني هذا العام,تم تهجير عدد كبير من السوريين المقيمين بالسعودية,disagree
لماذا يهز اقتصاد إيطاليا أسواق العالم؟,إيطاليا وحمى هبوط أسهم العالم,agree
تفجير سيارة مفخخة في سوريا يؤدي لمقتل رئيس مركز البحوث العلمية,تفجير سيارة مفخخة في اليمن يؤدي لمقتل رئيس مركز البحوث العلمية,disagree
ارتفاع في أسعار النفط وصعود في وول ستريت,انخفاض النفط عالميا وهبوط في وول ستريت,disagree
دي ميستورا مستعد للذهاب بنفسي إلى إدلب لضمان الخروج الآمن للمدنيين,دي ميستورا لا يكترث بأمر المدنيين فى إدلب,disagree
إقالة وزير الداخلية التونسي بعد أيام من غرق قارب للمهاجرين,إقالة وزير الدفاع التونسي بعد أيام من غرق قارب للمهاجرين,disagree
الكنيست الإسرائيلي: قراءة أولى لمشروع قانون يهودية الدولة المثير للجدل,أعلن الكنيست الإسرائيلي عن قراءة أولى لمشروع قانون يهودية الدولة المثير للجدل,agree
نساء الموصل يحتفلن بحريتهن فى يوم المرأة,نساء الموصل يواجهن الكبت و القيود المجتمعية,disagree
خطوة صينية تنذر بانفجار سكاني,الصين نحو إلغاء سياستها في تحديد النسل,disagree
مظاهرات البصرة: توقف العمل في ميناء أم قصر عقب اشتباكات عنيفة,توقف العمل فى ميناء أم قصر نتيجة للاشتباكات العنيفة فى مظاهرات البصرة,agree
70 مليون دولار لتأهيل قطاع النقل والموانئ في اليمن,تأهيل قطاع النقل والموانئ في اليمن يحتاج إلى 10 مليون دولار,disagree
هارفي واينستين يعلن تسليم نفسه للشرطة من أجل مواجهة تهم التحرش الجنسي,هارفي واينستين يعلن تسليم نفسه للشرطة من أجل مواجهة تهم السرقة,disagree
البورصة المصرية على موعد مع أسهم حكومية,مصر ترفض طرح حصص حكومية بالبورصة,disagree
الذهب يرتفع بسبب مخاوف التضخم,أسعار الذهب تهوي بسبب مخاوف التضخم,disagree
واشنطن تنقل سفارتها إلى القدس مايو المقبل,واشنطن تلغي قرار نقل سفارتها إلى القدس,disagree
إضراب عام للفلسطينيين في الضفة الغربية وقطاع غزة احتجاجا على قانون يهودية الدولة في إسرائيل,إهدوء تام فى الضفة الغربية وقطاع غزة,disagree
إنشاء وزارة الثقافة بالسعودية لتأمين المزيد من الرفاهية للشباب,نفي السعودية ما يتردد عن إنشاء وزارات جديدة,disagree
بومبيو يتهم إيران باستغلال محكمة العدل الدولية لأغراض سياسية,بومبيو يتهم العراق باستغلال محكمة العدل الدولية لأغراض سياسية,disagree
العملة الأرجنتينية تنهار و البنك المركز يتدخل,العملة الأرجنتينية تنهار و الولايت المتحدة تتدخل,disagree
القطرية تسعى لتعويض خسائرها بـإجراء جديد,لوقف الخسائر: الخطوط القطرية تتخذ إجراءات جديدة قريبا,agree
حكم بإعدام 16امرأة تركية بتهمة الانضمام لتنظيم الدولة الإسلامية فى العراق,حكم ببراءة 16امرأة تركية,disagree
مورغان ستانلي يرى قفزة كبيرة في أسعار النفط,مورغان ستانلي  يتوقع هبوطا حادا للنفط,disagree
اتفاق أمريكي تركي على انسحاب المسلحين الأكراد من منبج السورية,اتفاق بين أمريكا و تركيا على انسحاب المسلحين الأكراد من منبج السورية,agree
مجلس سوريا الديمقراطية: نعمل مع الحكومة على خارطة طريقة نحو دولة لا مركزية,يعمل مجلس سوريا الديمقراطية مع الحكومة على خطة نحو دولة لا مركزية,agree
تنديد فلسطيني واسع بعد الإفراج عن جندي إسرائيلي قتل جريحا,تجاهل فلسطيني بعد الإفراج عن جندي إسرائيلي,disagree
إقالة رئيس هيئة الترفيه في السعودية عقب عرض لاعبات سيرك بالرياض,إقالة رئيس هيئة الترفيه السعودي بعد عرض لاعبات السيرك المثير للجدل بالرياض,agree
مصر تتوقع عجزا في الموازنة 9.5-9.7 بالمئة,توقعات بعجز الموازنة المصرية,agree
توقيع عدة اتفاقيات بين الإمارات وموريتانيا,الإمارات توقع عدة اتفاقيات مع موريتانيا,agree
وزير الخارجية الإيراني يحذر ترامب,وزير الخارجية الإيراني يرحب بترامب,disagree
اندلاع أعمال عنف بين غزة وإسرائيل في يوم آخر من الاحتجاجات,أعمال عنف حادة بين غزة وإسرائيل في يوم جديد من الاحتجاجات,agree
من هي ناتالي بورتمان التي رفضت جائزة إسرائيلية بسبب غزة؟,ناتالي بورتمان ترفض جائزة أوسكار بسبب غزة,disagree
إيران تتحدى ترامب و تكشف عن طائرة مقاتلة جديدة محلية الصنع,إيران تعلن التعاون مع ترامب فى انتاج طائرة مقاتلة محلية الصنع,disagree
تغيير حكومى فى مصر و الدفاع و الداخلية أبرز التغييرات,استمرار الحكومة دون تغيير فى مصر,disagree
مصر تودع العراب أحمد خالد توفيق,وفاة المؤلف المصري  أحمد خالد توفيق,agree
أعلن الجيش المصري عن مقتل 71 مسلحا و7 عسكريين منذ بدء عملية سيناء,أعلن الجيش المصري يعلن فشل عملية سيناء,disagree
الجيش العراقي يقتل 45 من عناصر تنظيم الدولة في غارات جوية شرقي سوريا,مقتل 45 من عناصر تنظيم الدولة على يد الجيش العراقى في غارات جوية شرقي سوري,agree
صفعة اقتصادية قوية لإيران,إيران تتلقى صفعة اقتصادية قوية,agree
اعلان الحداد فى أرجاء فلسطين على قتلى يوم الأرض,تجاهل فتلى يوم الأرض فى فلسطين,disagree
التحقيق مع كاتب سعودي يشكو من كثرة المساجد وينتقد إزعاج الأذان,كاتب يدعم كثرة عدد المساجد ويطلب رفع صوت الأذان,disagree
ديرسم داغ: حكاية أصغر نائبة في تاريخ البرلمان التركي,حصول ديرسم داغ على مقعد في البرلمان التركي بالرغم من صغر سنها,agree
الطمث ووصمة العار.. مسلمات يواجهن الأفكار النمطية في رمضان,مسلمات يواجهن الأفكار النمطية في رمضان,agree
السعودية تفتح مجالها الجوى أمام الهند فى رحلاتها إلى تل أبيب,السعودية تغلق مجالها الجوى أمام الهند فى رحلاتها إلى تل أبيب,disagree
المغرب يقطع علاقاته مع إيران لدعمها جبهة البوليساريو,عودة العلاقات بين المغرب و إيران,disagree
أوروبا تحظر واردات اللحوم من 20 مصنعا بالبرازيل,اقصاء لواردات 20 مصنع لحوم برازيلي من أوروبا,agree
أردوغان يعزز سلطاته التنفيذية بعدة قرارات جديدة,أردوغان يصدر قرارات جديدة تعزز من سلطاته التنفيذية,agree
العملة التركية تتدهور إلى مستوى قياسي جديد,تدهور سريع بالليرة التركية,agree
آلاف المدنيين يفرون من الغوطة الشرقية وعفرين,المدنيين فى الغوطة الشرقية وعفرين يتمسكون بالبقاء,disagree
ملك الأردن يأمر بتجميد الزيادات في أسعار الوقود والكهرباء بعد إضراب النقابات,ملك السعودية يأمر بتجميد الزيادات في أسعار الوقود والكهرباء بعد إضراب النقابات,disagree
ولي العهد السعودي: الإسرائيليون لهم حق في الأرض,رفض ولي العهد السعودي الاعتراف بحق الإسرائيليين في الأرض,disagree
اختفاء جمال خاشقجي: أردوغان يتعهد بإعلان نتائج التحقيق في القضية,تعهد أردوغان بإعلان نتائج التحقيق في قضية اختفاء جمال خاشقجي,agree
الذهب يتأثر سلباً بقوة الدولار,ضعف الدولار يصعد الذهب,disagree
الصدر عقب لقاء العبادي: الحكومة العراقية الجديدة ستشمل الجميع,الصدر: حكومة العراق مخصصة لجانب واحد,disagree
بعد قرن ونصف.. تطوير مصري تاريخي بالسكك الحديدية,توقف تطوير السكك الحديدية المصرية,disagree
الممثلة الأمريكية غوينث بالترو تتزوج المنتج براد فالتشوك,زواج الممثلة الأمريكية غوينث بالترو من المنتج براد فالتشوك,agree
نفى محمد بن سلمان لترامب معرفته بمصير الصحفى جمال خاشقجي,محمد بن سلمان يقر بمعرفته بمصير الصحفى جمال خاشقجي,disagree
تحذير صيني بمواجهة تهديدات ترامب,الصين تحذر بأنها ستواجه تهديدات ترامب,agree
السعودية لا تزال تعتقل 9 بينهم 4 سيدات بتهمة الإضرار بالأمن,الافراج عن 9 مواطنين فى السعودية,disagree
اقالة رئيس جهاز الأمن الوطني الجزائري عبد الغني هامل,استمرار رئيس جهاز الأمن الوطني الجزائري عبد الغني هامل فى منصبه,disagree
براد بيت ينفي مزاعم أنجلينا جولي بالتقصير في نفقة أطفالهما,براد بيت ينفي أقوال أنجلينا جولي بشأن التقصير في نفقة أطفالهما,agree
